Source Resource	Source ID	Source Name	Mapping Type	Target Resource	Target ID	Target Name
reactome	R-HSA-163680	AMPK inhibits chREBP transcriptional activation activity	BFO:0000050	wikipathways	WP1403	AMP-activated Protein Kinase (AMPK) Signaling
reactome	R-HSA-176187	Activation of ATR in response to replication stress	BFO:0000050	wikipathways	WP3875	ATR Signaling
wikipathways	WP528	Acetylcholine Synthesis	BFO:0000050	reactome	R-HSA-1430728	Metabolism
wikipathways	WP699	Aflatoxin B1 metabolism	BFO:0000050	reactome	R-HSA-1430728	Metabolism
reactome	R-HSA-5423646	Aflatoxin activation and detoxification	BFO:0000050	wikipathways	WP699	Aflatoxin B1 metabolism
wikipathways	WP106	Alanine and aspartate metabolism	BFO:0000050	reactome	R-HSA-71291	Metabolism of amino acids and derivatives
wikipathways	WP106	Alanine and aspartate metabolism	BFO:0000050	reactome	R-HSA-70614	Amino acid synthesis and interconversion (transamination)
wikipathways	WP106	Alanine and aspartate metabolism	BFO:0000050	reactome	R-HSA-1430728	Metabolism
wikipathways	WP2328	Allograft Rejection	BFO:0000050	reactome	R-HSA-1280218	Adaptive Immune System
wikipathways	WP2328	Allograft Rejection	BFO:0000050	reactome	R-HSA-168256	Immune System
reactome	R-HSA-112412	SOS-mediated signalling	BFO:0000050	wikipathways	WP244	Alpha 6 Beta 4 signaling pathway
wikipathways	WP244	Alpha 6 Beta 4 signaling pathway	BFO:0000050	reactome	R-HSA-162582	Signal Transduction
wikipathways	WP3925	Amino Acid metabolism	skos:exactMatch	reactome	R-HSA-71291	Metabolism of amino acids and derivatives
wikipathways	WP3925	Amino Acid metabolism	BFO:0000050	reactome	R-HSA-71291	Metabolism of amino acids and derivatives
wikipathways	WP3925	Amino Acid metabolism	BFO:0000050	reactome	R-HSA-1430728	Metabolism
wikipathways	WP521	Amino acid conjugation of benzoic acid	BFO:0000050	reactome	R-HSA-159424	Conjugation of carboxylic acids
wikipathways	WP521	Amino acid conjugation of benzoic acid	BFO:0000050	reactome	R-HSA-1430728	Metabolism
wikipathways	WP521	Amino acid conjugation of benzoic acid	BFO:0000050	reactome	R-HSA-156587	Amino Acid conjugation
reactome	R-HSA-4411364	Binding of TCF/LEF:CTNNB1 to target gene promoters	BFO:0000050	wikipathways	WP3678	Amplification and Expansion of Oncogenic Pathways as Metastatic Traits
wikipathways	WP254	Apoptosis	skos:exactMatch	reactome	R-HSA-109581	Apoptosis
reactome	R-HSA-69416	Dimerization of procaspase-8	BFO:0000050	wikipathways	WP1772	Apoptosis Modulation and Signaling
reactome	R-HSA-111461	Cytochrome c-mediated apoptotic response	BFO:0000050	wikipathways	WP1772	Apoptosis Modulation and Signaling
reactome	R-HSA-111457	Release of apoptotic factors from the mitochondria	BFO:0000050	wikipathways	WP1772	Apoptosis Modulation and Signaling
reactome	R-HSA-75157	FasL/ CD95L signaling	BFO:0000050	wikipathways	WP1772	Apoptosis Modulation and Signaling
reactome	R-HSA-111458	Formation of apoptosome	BFO:0000050	wikipathways	WP1772	Apoptosis Modulation and Signaling
reactome	R-HSA-5357769	Caspase activation via extrinsic apoptotic signalling pathway	BFO:0000050	wikipathways	WP1772	Apoptosis Modulation and Signaling
reactome	R-HSA-6803207	TP53 Regulates Transcription of Caspase Activators and Caspases	BFO:0000050	wikipathways	WP1772	Apoptosis Modulation and Signaling
reactome	R-HSA-5218900	CASP8 activity is inhibited	BFO:0000050	wikipathways	WP1772	Apoptosis Modulation and Signaling
reactome	R-HSA-111471	Apoptotic factor-mediated response	BFO:0000050	wikipathways	WP1772	Apoptosis Modulation and Signaling
reactome	R-HSA-114294	Activation, translocation and oligomerization of BAX	BFO:0000050	wikipathways	WP1772	Apoptosis Modulation and Signaling
reactome	R-HSA-111452	Activation and oligomerization of BAK protein	BFO:0000050	wikipathways	WP1772	Apoptosis Modulation and Signaling
reactome	R-HSA-111453	BH3-only proteins associate with and inactivate anti-apoptotic BCL-2 members	BFO:0000050	wikipathways	WP1772	Apoptosis Modulation and Signaling
wikipathways	WP1772	Apoptosis Modulation and Signaling	BFO:0000050	reactome	R-HSA-109581	Apoptosis
reactome	R-HSA-111459	Activation of caspases through apoptosome-mediated cleavage	BFO:0000050	wikipathways	WP1772	Apoptosis Modulation and Signaling
wikipathways	WP384	Apoptosis Modulation by HSP70	BFO:0000050	reactome	R-HSA-111471	Apoptotic factor-mediated response
wikipathways	WP384	Apoptosis Modulation by HSP70	BFO:0000050	reactome	R-HSA-109581	Apoptosis
wikipathways	WP384	Apoptosis Modulation by HSP70	BFO:0000050	reactome	R-HSA-5357801	Programmed Cell Death
wikipathways	WP678	Arachidonate Epoxygenase / Epoxide Hydrolase	BFO:0000050	reactome	R-HSA-1430728	Metabolism
wikipathways	WP678	Arachidonate Epoxygenase / Epoxide Hydrolase	BFO:0000050	reactome	R-HSA-556833	Metabolism of lipids
wikipathways	WP678	Arachidonate Epoxygenase / Epoxide Hydrolase	BFO:0000050	reactome	R-HSA-211859	Biological oxidations
wikipathways	WP678	Arachidonate Epoxygenase / Epoxide Hydrolase	BFO:0000050	reactome	R-HSA-8978868	Fatty acid metabolism
wikipathways	WP678	Arachidonate Epoxygenase / Epoxide Hydrolase	BFO:0000050	reactome	R-HSA-2142753	Arachidonic acid metabolism
wikipathways	WP2586	Aryl Hydrocarbon Receptor	skos:exactMatch	reactome	R-HSA-8937144	Aryl hydrocarbon receptor signalling
wikipathways	WP2873	Aryl Hydrocarbon Receptor Pathway	skos:exactMatch	reactome	R-HSA-8937144	Aryl hydrocarbon receptor signalling
wikipathways	WP694	Arylamine metabolism	BFO:0000050	reactome	R-HSA-1430728	Metabolism
wikipathways	WP23	B Cell Receptor Signaling Pathway	skos:exactMatch	reactome	R-HSA-983705	Signaling by the B Cell Receptor (BCR)
wikipathways	WP23	B Cell Receptor Signaling Pathway	BFO:0000050	reactome	R-HSA-1280218	Adaptive Immune System
wikipathways	WP23	B Cell Receptor Signaling Pathway	BFO:0000050	reactome	R-HSA-168256	Immune System
wikipathways	WP3676	BDNF-TrkB Signaling	BFO:0000050	reactome	R-HSA-162582	Signal Transduction
wikipathways	WP3891	Benzene metabolism	BFO:0000050	reactome	R-HSA-1430728	Metabolism
wikipathways	WP696	Benzo(a)pyrene metabolism	BFO:0000050	reactome	R-HSA-1430728	Metabolism
reactome	R-HSA-380612	Metabolism of serotonin	BFO:0000050	wikipathways	WP550	Biogenic Amine Synthesis
reactome	R-HSA-888568	GABA synthesis	BFO:0000050	wikipathways	WP550	Biogenic Amine Synthesis
reactome	R-HSA-209931	Serotonin and melatonin biosynthesis	BFO:0000050	wikipathways	WP550	Biogenic Amine Synthesis
reactome	R-HSA-888590	GABA synthesis, release, reuptake and degradation	BFO:0000050	wikipathways	WP550	Biogenic Amine Synthesis
reactome	R-HSA-209905	Catecholamine biosynthesis	BFO:0000050	wikipathways	WP550	Biogenic Amine Synthesis
wikipathways	WP550	Biogenic Amine Synthesis	BFO:0000050	reactome	R-HSA-1430728	Metabolism
reactome	R-HSA-140834	Extrinsic Pathway of Fibrin Clot Formation	BFO:0000050	wikipathways	WP272	Blood Clotting Cascade
reactome	R-HSA-75205	Dissolution of Fibrin Clot	BFO:0000050	wikipathways	WP272	Blood Clotting Cascade
wikipathways	WP272	Blood Clotting Cascade	BFO:0000050	reactome	R-HSA-109582	Hemostasis
reactome	R-HSA-140877	Formation of Fibrin Clot (Clotting Cascade)	BFO:0000050	wikipathways	WP272	Blood Clotting Cascade
wikipathways	WP1425	Bone Morphogenic Protein (BMP) Signalling and Regulation	skos:exactMatch	reactome	R-HSA-201451	Signaling by BMP
wikipathways	WP2366	Butyrate-induced histone acetylation	BFO:0000050	reactome	R-HSA-1430728	Metabolism
wikipathways	WP3633	Caffeine and Theobromine metabolism	BFO:0000050	reactome	R-HSA-1430728	Metabolism
reactome	R-HSA-211957	Aromatic amines can be N-hydroxylated or N-dealkylated by CYP1A2	BFO:0000050	wikipathways	WP3633	Caffeine and Theobromine metabolism
wikipathways	WP3633	Caffeine and Theobromine metabolism	BFO:0000050	reactome	R-HSA-211981	Xenobiotics
reactome	R-HSA-390648	Muscarinic acetylcholine receptors	BFO:0000050	wikipathways	WP536	Calcium Regulation in the Cardiac Cell
reactome	R-HSA-190827	Transport of connexins along the secretory pathway	BFO:0000050	wikipathways	WP536	Calcium Regulation in the Cardiac Cell
wikipathways	WP3869	Cannabinoid receptor signaling	BFO:0000050	reactome	R-HSA-162582	Signal Transduction
wikipathways	WP3845	Canonical  and Non-canonical Notch signaling	skos:exactMatch	reactome	R-HSA-157118	Signaling by NOTCH
reactome	R-HSA-9012852	Signaling by NOTCH3	BFO:0000050	wikipathways	WP3845	Canonical  and Non-canonical Notch signaling
reactome	R-HSA-2979096	NOTCH2 Activation and Transmission of Signal to the Nucleus	BFO:0000050	wikipathways	WP3845	Canonical  and Non-canonical Notch signaling
reactome	R-HSA-9013694	Signaling by NOTCH4	BFO:0000050	wikipathways	WP3845	Canonical  and Non-canonical Notch signaling
reactome	R-HSA-350054	Notch-HLH transcription pathway	BFO:0000050	wikipathways	WP3845	Canonical  and Non-canonical Notch signaling
wikipathways	WP3845	Canonical  and Non-canonical Notch signaling	BFO:0000050	reactome	R-HSA-162582	Signal Transduction
reactome	R-HSA-1980143	Signaling by NOTCH1	BFO:0000050	wikipathways	WP3845	Canonical  and Non-canonical Notch signaling
reactome	R-HSA-2660825	Signaling by NOTCH1 t(7;9)(NOTCH1:M1580_K2555) Translocation Mutant	BFO:0000050	wikipathways	WP3845	Canonical  and Non-canonical Notch signaling
reactome	R-HSA-2122948	Activated NOTCH1 Transmits Signal to the Nucleus	BFO:0000050	wikipathways	WP3845	Canonical  and Non-canonical Notch signaling
reactome	R-HSA-157118	Signaling by NOTCH	BFO:0000050	wikipathways	WP3845	Canonical  and Non-canonical Notch signaling
reactome	R-HSA-9013508	NOTCH3 Intracellular Domain Regulates Transcription	BFO:0000050	wikipathways	WP3845	Canonical  and Non-canonical Notch signaling
reactome	R-HSA-1980145	Signaling by NOTCH2	BFO:0000050	wikipathways	WP3845	Canonical  and Non-canonical Notch signaling
reactome	R-HSA-1912399	Pre-NOTCH Processing in the Endoplasmic Reticulum	BFO:0000050	wikipathways	WP3845	Canonical  and Non-canonical Notch signaling
reactome	R-HSA-5083630	Defective LFNG causes SCDO3	BFO:0000050	wikipathways	WP3845	Canonical  and Non-canonical Notch signaling
reactome	R-HSA-8941856	RUNX3 regulates NOTCH signaling	BFO:0000050	wikipathways	WP3845	Canonical  and Non-canonical Notch signaling
reactome	R-HSA-2660826	Constitutive Signaling by NOTCH1 t(7;9)(NOTCH1:M1580_K2555) Translocation Mutant	BFO:0000050	wikipathways	WP3845	Canonical  and Non-canonical Notch signaling
reactome	R-HSA-9013507	NOTCH3 Activation and Transmission of Signal to the Nucleus	BFO:0000050	wikipathways	WP3845	Canonical  and Non-canonical Notch signaling
wikipathways	WP3874	Canonical and Non-Canonical TGF-B signaling	skos:exactMatch	reactome	R-HSA-170834	Signaling by TGF-beta Receptor Complex
reactome	R-HSA-3304351	Signaling by TGF-beta Receptor Complex in Cancer	BFO:0000050	wikipathways	WP3874	Canonical and Non-Canonical TGF-B signaling
wikipathways	WP179	Cell Cycle	skos:exactMatch	reactome	R-HSA-1640170	Cell Cycle
reactome	R-HSA-380108	Chemokine receptors bind chemokines	BFO:0000050	wikipathways	WP3929	Chemokine signaling pathway
wikipathways	WP197	Cholesterol Biosynthesis	skos:exactMatch	reactome	R-HSA-191273	Cholesterol biosynthesis
wikipathways	WP197	Cholesterol Biosynthesis	BFO:0000050	reactome	R-HSA-556833	Metabolism of lipids
wikipathways	WP197	Cholesterol Biosynthesis	BFO:0000050	reactome	R-HSA-1430728	Metabolism
reactome	R-HSA-6807047	Cholesterol biosynthesis via desmosterol	BFO:0000050	wikipathways	WP197	Cholesterol Biosynthesis
wikipathways	WP197	Cholesterol Biosynthesis	BFO:0000050	reactome	R-HSA-8957322	Metabolism of steroids
reactome	R-HSA-6807062	Cholesterol biosynthesis via lathosterol	BFO:0000050	wikipathways	WP197	Cholesterol Biosynthesis
reactome	R-HSA-3315487	SMAD2/3 MH2 Domain Mutants in Cancer	BFO:0000050	wikipathways	WP4216	Chromosomal and microsatellite instability in colorectal cancer
reactome	R-HSA-3311021	SMAD4 MH2 Domain Mutants in Cancer	BFO:0000050	wikipathways	WP4216	Chromosomal and microsatellite instability in colorectal cancer
reactome	R-HSA-3304347	Loss of Function of SMAD4 in Cancer	BFO:0000050	wikipathways	WP4216	Chromosomal and microsatellite instability in colorectal cancer
wikipathways	WP2826	Cocaine metabolism	BFO:0000050	reactome	R-HSA-1430728	Metabolism
wikipathways	WP1604	Codeine and Morphine Metabolism	BFO:0000050	reactome	R-HSA-1430728	Metabolism
wikipathways	WP2536	Colchicine Metabolic Pathway	BFO:0000050	reactome	R-HSA-1430728	Metabolism
wikipathways	WP545	Complement Activation	skos:exactMatch	reactome	R-HSA-166658	Complement cascade
reactome	R-HSA-977606	Regulation of Complement cascade	BFO:0000050	wikipathways	WP545	Complement Activation
reactome	R-HSA-174577	Activation of C3 and C5	BFO:0000050	wikipathways	WP545	Complement Activation
reactome	R-HSA-166665	Terminal pathway of complement	BFO:0000050	wikipathways	WP545	Complement Activation
reactome	R-HSA-166663	Initial triggering of complement	BFO:0000050	wikipathways	WP545	Complement Activation
reactome	R-HSA-166662	Lectin pathway of complement activation	BFO:0000050	wikipathways	WP558	Complement and Coagulation Cascades
reactome	R-HSA-76002	Platelet activation, signaling and aggregation	BFO:0000050	wikipathways	WP558	Complement and Coagulation Cascades
reactome	R-HSA-977606	Regulation of Complement cascade	BFO:0000050	wikipathways	WP558	Complement and Coagulation Cascades
reactome	R-HSA-174577	Activation of C3 and C5	BFO:0000050	wikipathways	WP558	Complement and Coagulation Cascades
reactome	R-HSA-140837	Intrinsic Pathway of Fibrin Clot Formation	BFO:0000050	wikipathways	WP558	Complement and Coagulation Cascades
reactome	R-HSA-140834	Extrinsic Pathway of Fibrin Clot Formation	BFO:0000050	wikipathways	WP558	Complement and Coagulation Cascades
reactome	R-HSA-166665	Terminal pathway of complement	BFO:0000050	wikipathways	WP558	Complement and Coagulation Cascades
reactome	R-HSA-109582	Hemostasis	BFO:0000050	wikipathways	WP558	Complement and Coagulation Cascades
reactome	R-HSA-140875	Common Pathway of Fibrin Clot Formation	BFO:0000050	wikipathways	WP558	Complement and Coagulation Cascades
reactome	R-HSA-168256	Immune System	BFO:0000050	wikipathways	WP558	Complement and Coagulation Cascades
reactome	R-HSA-140877	Formation of Fibrin Clot (Clotting Cascade)	BFO:0000050	wikipathways	WP558	Complement and Coagulation Cascades
reactome	R-HSA-75205	Dissolution of Fibrin Clot	BFO:0000050	wikipathways	WP558	Complement and Coagulation Cascades
reactome	R-HSA-173736	Alternative complement activation	BFO:0000050	wikipathways	WP558	Complement and Coagulation Cascades
reactome	R-HSA-166658	Complement cascade	BFO:0000050	wikipathways	WP558	Complement and Coagulation Cascades
wikipathways	WP3601	Composition of Lipid Particles	BFO:0000050	reactome	R-HSA-1430728	Metabolism
wikipathways	WP3286	Copper homeostasis	BFO:0000050	reactome	R-HSA-1222541	Cell redox homeostasis
wikipathways	WP1946	Cori Cycle	BFO:0000050	reactome	R-HSA-1430728	Metabolism
wikipathways	WP1946	Cori Cycle	BFO:0000050	reactome	R-HSA-70326	Glucose metabolism
wikipathways	WP1946	Cori Cycle	BFO:0000050	reactome	R-HSA-71387	Metabolism of carbohydrates
wikipathways	WP2355	Corticotropin-releasing hormone signaling pathway	BFO:0000050	reactome	R-HSA-194002	Glucocorticoid biosynthesis
wikipathways	WP530	Cytokines and Inflammatory Response	skos:exactMatch	reactome	R-HSA-1280215	Cytokine Signaling in Immune system
reactome	R-HSA-448706	Interleukin-1 processing	BFO:0000050	wikipathways	WP530	Cytokines and Inflammatory Response
reactome	R-HSA-6785807	Interleukin-4 and 13 signaling	BFO:0000050	wikipathways	WP530	Cytokines and Inflammatory Response
reactome	R-HSA-449147	Signaling by Interleukins	BFO:0000050	wikipathways	WP530	Cytokines and Inflammatory Response
wikipathways	WP530	Cytokines and Inflammatory Response	BFO:0000050	reactome	R-HSA-168256	Immune System
wikipathways	WP3585	Cytosine methylation	BFO:0000050	reactome	R-HSA-5334118	DNA methylation
wikipathways	WP3585	Cytosine methylation	BFO:0000050	reactome	R-HSA-156581	Methylation
reactome	R-HSA-69563	p53-Dependent G1 DNA Damage Response	BFO:0000050	wikipathways	WP707	DNA Damage Response
reactome	R-HSA-73893	DNA Damage Bypass	BFO:0000050	wikipathways	WP707	DNA Damage Response
reactome	R-HSA-69610	p53-Independent DNA Damage Response	BFO:0000050	wikipathways	WP707	DNA Damage Response
reactome	R-HSA-69615	G1/S DNA Damage Checkpoints	BFO:0000050	wikipathways	WP707	DNA Damage Response
reactome	R-HSA-73942	DNA Damage Reversal	BFO:0000050	wikipathways	WP707	DNA Damage Response
reactome	R-HSA-112412	SOS-mediated signalling	BFO:0000050	wikipathways	WP710	DNA Damage Response (only ATM dependent)
wikipathways	WP3959	DNA IR-Double Strand Breaks (DSBs) and cellular response via ATM	BFO:0000050	reactome	R-HSA-73894	DNA Repair
wikipathways	WP3959	DNA IR-Double Strand Breaks (DSBs) and cellular response via ATM	BFO:0000050	reactome	R-HSA-5693606	DNA Double Strand Break Response
wikipathways	WP4016	DNA IR-damage and cellular response via ATR	BFO:0000050	reactome	R-HSA-5693548	Sensing of DNA Double Strand Breaks
wikipathways	WP4016	DNA IR-damage and cellular response via ATR	BFO:0000050	reactome	R-HSA-73894	DNA Repair
wikipathways	WP466	DNA Replication	skos:exactMatch	reactome	R-HSA-69306	DNA Replication
wikipathways	WP4153	Degradation pathway of sphingolipids, including diseases	BFO:0000050	reactome	R-HSA-428157	Sphingolipid metabolism
wikipathways	WP4153	Degradation pathway of sphingolipids, including diseases	BFO:0000050	reactome	R-HSA-1430728	Metabolism
wikipathways	WP4153	Degradation pathway of sphingolipids, including diseases	BFO:0000050	reactome	R-HSA-556833	Metabolism of lipids
wikipathways	WP4153	Degradation pathway of sphingolipids, including diseases	BFO:0000050	reactome	R-HSA-1660662	Glycosphingolipid metabolism
wikipathways	WP3892	Development of pulmonary dendritic cells and macrophage subsets	BFO:0000050	reactome	R-HSA-168256	Immune System
wikipathways	WP2491	Diclofenac Metabolic Pathway	BFO:0000050	reactome	R-HSA-1430728	Metabolism
wikipathways	WP2491	Diclofenac Metabolic Pathway	BFO:0000050	reactome	R-HSA-211897	Cytochrome P450 - arranged by substrate type
reactome	R-HSA-381340	Transcriptional regulation of white adipocyte differentiation	BFO:0000050	wikipathways	WP2895	Differentiation of white and brown adipocyte
wikipathways	WP2895	Differentiation of white and brown adipocyte	BFO:0000050	reactome	R-HSA-1266738	Developmental Biology
reactome	R-HSA-140179	Amine Oxidase reactions	BFO:0000050	wikipathways	WP2436	Dopamine metabolism
reactome	R-HSA-390651	Dopamine receptors	BFO:0000050	wikipathways	WP2436	Dopamine metabolism
reactome	R-HSA-379398	Enzymatic degradation of Dopamine by monoamine oxidase	BFO:0000050	wikipathways	WP2436	Dopamine metabolism
wikipathways	WP2436	Dopamine metabolism	BFO:0000050	reactome	R-HSA-1430728	Metabolism
reactome	R-HSA-379397	Enzymatic degradation of dopamine by COMT	BFO:0000050	wikipathways	WP2436	Dopamine metabolism
reactome	R-HSA-141333	Biogenic amines are oxidatively deaminated to aldehydes by MAOA and MAOB	BFO:0000050	wikipathways	WP2436	Dopamine metabolism
reactome	R-HSA-379401	Dopamine clearance from the synaptic cleft	BFO:0000050	wikipathways	WP2436	Dopamine metabolism
wikipathways	WP3300	Dual hijack model of Vif in HIV infection	BFO:0000050	reactome	R-HSA-162906	HIV Infection
reactome	R-HSA-180336	SHC1 events in EGFR signaling	BFO:0000050	wikipathways	WP437	EGF/EGFR Signaling Pathway
reactome	R-HSA-182971	EGFR downregulation	BFO:0000050	wikipathways	WP437	EGF/EGFR Signaling Pathway
reactome	R-HSA-1251932	PLCG1 events in ERBB2 signaling	BFO:0000050	wikipathways	WP437	EGF/EGFR Signaling Pathway
wikipathways	WP437	EGF/EGFR Signaling Pathway	BFO:0000050	reactome	R-HSA-212718	EGFR interacts with phospholipase C-gamma
reactome	R-HSA-212718	EGFR interacts with phospholipase C-gamma	BFO:0000050	wikipathways	WP437	EGF/EGFR Signaling Pathway
wikipathways	WP437	EGF/EGFR Signaling Pathway	BFO:0000050	reactome	R-HSA-5638303	Inhibition of Signaling by Overexpressed EGFR
reactome	R-HSA-5638303	Inhibition of Signaling by Overexpressed EGFR	BFO:0000050	wikipathways	WP437	EGF/EGFR Signaling Pathway
reactome	R-HSA-179812	GRB2 events in EGFR signaling	BFO:0000050	wikipathways	WP437	EGF/EGFR Signaling Pathway
reactome	R-HSA-2179392	EGFR Transactivation by Gastrin	BFO:0000050	wikipathways	WP437	EGF/EGFR Signaling Pathway
reactome	R-HSA-392154	Nitric oxide stimulates guanylate cyclase	BFO:0000050	wikipathways	WP1995	Effects of Nitric Oxide
wikipathways	WP167	Eicosanoid Synthesis	BFO:0000050	reactome	R-HSA-2142753	Arachidonic acid metabolism
wikipathways	WP167	Eicosanoid Synthesis	BFO:0000050	reactome	R-HSA-211979	Eicosanoids
wikipathways	WP167	Eicosanoid Synthesis	BFO:0000050	reactome	R-HSA-556833	Metabolism of lipids
wikipathways	WP167	Eicosanoid Synthesis	BFO:0000050	reactome	R-HSA-1430728	Metabolism
wikipathways	WP111	Electron Transport Chain	skos:exactMatch	reactome	R-HSA-611105	Respiratory electron transport
reactome	R-HSA-8941284	RUNX2 regulates chondrocyte maturation	BFO:0000050	wikipathways	WP474	Endochondral Ossification
reactome	R-HSA-442717	CREB phosphorylation through the activation of CaMKK	BFO:0000050	wikipathways	WP1541	Energy Metabolism
reactome	R-HSA-111932	CaMK IV-mediated phosphorylation of CREB	BFO:0000050	wikipathways	WP1541	Energy Metabolism
wikipathways	WP1541	Energy Metabolism	BFO:0000050	reactome	R-HSA-1430728	Metabolism
reactome	R-HSA-1592230	Mitochondrial biogenesis	BFO:0000050	wikipathways	WP1541	Energy Metabolism
reactome	R-HSA-212718	EGFR interacts with phospholipase C-gamma	BFO:0000050	wikipathways	WP673	ErbB Signaling Pathway
reactome	R-HSA-1227986	Signaling by ERBB2	BFO:0000050	wikipathways	WP673	ErbB Signaling Pathway
reactome	R-HSA-1250347	SHC1 events in ERBB4 signaling	BFO:0000050	wikipathways	WP673	ErbB Signaling Pathway
reactome	R-HSA-1963642	PI3K events in ERBB2 signaling	BFO:0000050	wikipathways	WP673	ErbB Signaling Pathway
reactome	R-HSA-6785631	ERBB2 Regulates Cell Motility	BFO:0000050	wikipathways	WP673	ErbB Signaling Pathway
reactome	R-HSA-8847993	ERBB2 Activates PTK6 Signaling	BFO:0000050	wikipathways	WP673	ErbB Signaling Pathway
reactome	R-HSA-180336	SHC1 events in EGFR signaling	BFO:0000050	wikipathways	WP673	ErbB Signaling Pathway
reactome	R-HSA-1236382	Constitutive Signaling by Ligand-Responsive EGFR Cancer Variants	BFO:0000050	wikipathways	WP673	ErbB Signaling Pathway
reactome	R-HSA-1250342	PI3K events in ERBB4 signaling	BFO:0000050	wikipathways	WP673	ErbB Signaling Pathway
reactome	R-HSA-1251932	PLCG1 events in ERBB2 signaling	BFO:0000050	wikipathways	WP673	ErbB Signaling Pathway
reactome	R-HSA-1643713	Signaling by EGFR in Cancer	BFO:0000050	wikipathways	WP673	ErbB Signaling Pathway
reactome	R-HSA-5638303	Inhibition of Signaling by Overexpressed EGFR	BFO:0000050	wikipathways	WP673	ErbB Signaling Pathway
reactome	R-HSA-1250196	SHC1 events in ERBB2 signaling	BFO:0000050	wikipathways	WP673	ErbB Signaling Pathway
reactome	R-HSA-179812	GRB2 events in EGFR signaling	BFO:0000050	wikipathways	WP673	ErbB Signaling Pathway
reactome	R-HSA-2179392	EGFR Transactivation by Gastrin	BFO:0000050	wikipathways	WP673	ErbB Signaling Pathway
reactome	R-HSA-5638302	Signaling by Overexpressed Wild-Type EGFR in Cancer	BFO:0000050	wikipathways	WP673	ErbB Signaling Pathway
reactome	R-HSA-1306955	GRB7 events in ERBB2 signaling	BFO:0000050	wikipathways	WP673	ErbB Signaling Pathway
reactome	R-HSA-5637815	Signaling by Ligand-Responsive EGFR Variants in Cancer	BFO:0000050	wikipathways	WP673	ErbB Signaling Pathway
reactome	R-HSA-1963640	GRB2 events in ERBB2 signaling	BFO:0000050	wikipathways	WP673	ErbB Signaling Pathway
wikipathways	WP697	Estrogen metabolism	BFO:0000050	reactome	R-HSA-1430728	Metabolism
wikipathways	WP314	Fas Ligand (FasL) pathway and Stress induction of Heat Shock Proteins (HSP) regulation	BFO:0000050	reactome	R-HSA-140534	Ligand-dependent caspase activation
wikipathways	WP314	Fas Ligand (FasL) pathway and Stress induction of Heat Shock Proteins (HSP) regulation	BFO:0000050	reactome	R-HSA-109581	Apoptosis
wikipathways	WP314	Fas Ligand (FasL) pathway and Stress induction of Heat Shock Proteins (HSP) regulation	BFO:0000050	reactome	R-HSA-5357801	Programmed Cell Death
wikipathways	WP314	Fas Ligand (FasL) pathway and Stress induction of Heat Shock Proteins (HSP) regulation	BFO:0000050	reactome	R-HSA-211736	Stimulation of the cell death response by PAK-2p34
reactome	R-HSA-75157	FasL/ CD95L signaling	BFO:0000050	wikipathways	WP314	Fas Ligand (FasL) pathway and Stress induction of Heat Shock Proteins (HSP) regulation
wikipathways	WP314	Fas Ligand (FasL) pathway and Stress induction of Heat Shock Proteins (HSP) regulation	BFO:0000050	reactome	R-HSA-111458	Formation of apoptosome
wikipathways	WP143	Fatty Acid Beta Oxidation	skos:exactMatch	reactome	R-HSA-77289	Mitochondrial Fatty Acid Beta-Oxidation
reactome	R-HSA-77350	Beta oxidation of hexanoyl-CoA to butanoyl-CoA	BFO:0000050	wikipathways	WP143	Fatty Acid Beta Oxidation
reactome	R-HSA-77352	Beta oxidation of butanoyl-CoA to acetyl-CoA	BFO:0000050	wikipathways	WP143	Fatty Acid Beta Oxidation
reactome	R-HSA-77286	mitochondrial fatty acid beta-oxidation of saturated fatty acids	BFO:0000050	wikipathways	WP143	Fatty Acid Beta Oxidation
reactome	R-HSA-77310	Beta oxidation of lauroyl-CoA to decanoyl-CoA-CoA	BFO:0000050	wikipathways	WP143	Fatty Acid Beta Oxidation
reactome	R-HSA-77346	Beta oxidation of decanoyl-CoA to octanoyl-CoA-CoA	BFO:0000050	wikipathways	WP143	Fatty Acid Beta Oxidation
reactome	R-HSA-77305	Beta oxidation of palmitoyl-CoA to myristoyl-CoA	BFO:0000050	wikipathways	WP143	Fatty Acid Beta Oxidation
wikipathways	WP143	Fatty Acid Beta Oxidation	BFO:0000050	reactome	R-HSA-8978868	Fatty acid metabolism
reactome	R-HSA-77288	mitochondrial fatty acid beta-oxidation of unsaturated fatty acids	BFO:0000050	wikipathways	WP143	Fatty Acid Beta Oxidation
reactome	R-HSA-77285	Beta oxidation of myristoyl-CoA to lauroyl-CoA	BFO:0000050	wikipathways	WP143	Fatty Acid Beta Oxidation
wikipathways	WP143	Fatty Acid Beta Oxidation	BFO:0000050	reactome	R-HSA-1430728	Metabolism
